{
  "$schema": "http://json-schema.org/draft-07/schema#",
  "$id": "https://port-daddy.dev/schemas/transformers-js-onnx-pipelines-plan.schema.json",
  "title": "Transformers.js ONNX Pipeline Plan",
  "description": "A structured plan for a Transformers.js integration -- pipeline type, environment, caching, and logits-access decisions -- so this skill's Quality Gates can be checked deterministically by scripts/transformers_js_onnx_pipelines_audit.mjs.",
  "type": "object",
  "required": ["pipelineType", "environment", "runsInCI"],
  "additionalProperties": true,
  "properties": {
    "pipelineType": {
      "type": "string",
      "enum": ["bi-encoder", "cross-encoder", "classification"],
      "description": "The shape of the pipeline: sentence embeddings (bi-encoder), (query, candidate) reranking (cross-encoder), or single-input classification."
    },
    "environment": {
      "type": "string",
      "enum": ["node", "browser"],
      "description": "Where inference runs."
    },
    "runsInCI": {
      "type": "boolean",
      "description": "Whether this pipeline is also exercised in CI (tests, corpus builds)."
    },
    "usesHighLevelPipeline": {
      "type": "boolean",
      "description": "True if the integration goes through pipeline() rather than AutoTokenizer + AutoModel* directly."
    },
    "readsRawLogits": {
      "type": "boolean",
      "description": "True if scores are read from outputs.logits.data directly (required for single-logit cross-encoder heads)."
    },
    "maxCandidateTokens": {
      "type": "number",
      "minimum": 0,
      "description": "Upper bound on candidate text length in tokens fed to a cross-encoder; must fit the 512-token joint (query, candidate) limit."
    },
    "pooling": {
      "type": "string",
      "enum": ["mean-attention-mask-v1", "cls-last-hidden-state-v1"],
      "description": "Exact versioned pooling recipe used for bi-encoder sentence embeddings; generic mean/cls labels are insufficient."
    },
    "normalizeEmbeddings": {
      "type": "boolean",
      "description": "True if embeddings are L2-normalized so cosine equals dot product."
    },
    "loaderModelId": {
      "type": "string",
      "minLength": 1,
      "description": "Exact model id passed to the loader; for a bi-encoder it must equal embeddingProfile.modelId."
    },
    "loaderRevision": {
      "type": "string",
      "pattern": "^[0-9a-f]{40}$",
      "description": "Exact immutable revision passed to the loader; for a bi-encoder it must equal embeddingProfile.modelRevision."
    },
    "maxInputTokens": {
      "type": "integer",
      "minimum": 1,
      "description": "Token limit actually used by the embedding invocation; it must equal embeddingProfile.maxTokens."
    },
    "embeddingSpace": false,
    "embeddingProfile": {
      "type": "object",
      "additionalProperties": false,
      "required": [
        "version",
        "servingProvider",
        "executionClass",
        "retrievalRoles",
        "qualityTier",
        "modelId",
        "runtimeFamily",
        "runtimeVersion",
        "upstreamModelId",
        "modelRevision",
        "modelArtifact",
        "modelDigest",
        "modelConfigArtifact",
        "modelConfigDigest",
        "tokenizerId",
        "tokenizerRevision",
        "tokenizerArtifact",
        "tokenizerDigest",
        "tokenizerConfigArtifact",
        "tokenizerConfigDigest",
        "task",
        "queryPrefix",
        "documentPrefix",
        "unicodeNormalization",
        "truncation",
        "maxTokens",
        "pooling",
        "normalization",
        "metric",
        "dimensions",
        "coordinatePrecision",
        "coordinateQuantization",
        "transportEncoding",
        "storageEncoding",
        "storageQuantization",
        "preprocessingDigest",
        "spaceId",
        "quality",
        "revisionBinding",
        "runtimeBinding"
      ],
      "properties": {
        "version": { "const": 2 },
        "servingProvider": { "type": "string", "minLength": 1 },
        "executionClass": { "type": "string", "enum": ["local", "self-hosted", "remote"] },
        "retrievalRoles": {
          "type": "array",
          "minItems": 1,
          "uniqueItems": true,
          "items": { "type": "string", "enum": ["text_dense", "code_dense", "ui_multimodal_dense", "rerank"] }
        },
        "qualityTier": { "type": "string", "enum": ["local_fast", "local_quality", "remote_quality"] },
        "modelId": { "type": "string", "minLength": 1 },
        "runtimeFamily": { "type": "string", "minLength": 1 },
        "runtimeVersion": { "type": "string", "minLength": 1 },
        "upstreamModelId": { "type": "string", "minLength": 1 },
        "modelRevision": { "type": "string", "pattern": "^[0-9a-f]{40}$" },
        "modelArtifact": { "type": "string", "pattern": "^(?!/)(?!.*(?:^|/)\\.\\.(?:/|$))[A-Za-z0-9._/+@=-]+$" },
        "modelDigest": { "type": "string", "pattern": "^sha256:[0-9a-f]{64}$" },
        "modelConfigArtifact": { "type": "string", "pattern": "^(?!/)(?!.*(?:^|/)\\.\\.(?:/|$))[A-Za-z0-9._/+@=-]+$" },
        "modelConfigDigest": { "type": "string", "pattern": "^sha256:[0-9a-f]{64}$" },
        "tokenizerId": { "type": "string", "minLength": 1 },
        "tokenizerRevision": { "type": "string", "pattern": "^[0-9a-f]{40}$" },
        "tokenizerArtifact": { "type": "string", "pattern": "^(?!/)(?!.*(?:^|/)\\.\\.(?:/|$))[A-Za-z0-9._/+@=-]+$" },
        "tokenizerDigest": { "type": "string", "pattern": "^sha256:[0-9a-f]{64}$" },
        "tokenizerConfigArtifact": { "type": "string", "pattern": "^(?!/)(?!.*(?:^|/)\\.\\.(?:/|$))[A-Za-z0-9._/+@=-]+$" },
        "tokenizerConfigDigest": { "type": "string", "pattern": "^sha256:[0-9a-f]{64}$" },
        "task": { "type": "string", "enum": ["feature-extraction", "sentence-similarity"] },
        "queryPrefix": { "type": "string" },
        "documentPrefix": { "type": "string" },
        "unicodeNormalization": { "type": "string", "enum": ["none", "nfc", "nfkc", "tokenizer-defined"] },
        "truncation": { "type": "string", "enum": ["longest-first", "only-first"] },
        "maxTokens": { "type": "integer", "minimum": 1 },
        "pooling": { "type": "string", "enum": ["mean-attention-mask-v1", "cls-last-hidden-state-v1"] },
        "normalization": { "type": "string", "enum": ["l2", "none"] },
        "metric": { "type": "string", "enum": ["cosine", "dot-product", "euclidean"] },
        "dimensions": { "type": "integer", "minimum": 1 },
        "coordinatePrecision": { "type": "string", "enum": ["float16", "float32", "float64"] },
        "coordinateQuantization": { "const": "none" },
        "transportEncoding": { "type": "string", "enum": ["json-number-array", "float32-array"] },
        "storageEncoding": { "type": "string", "enum": ["json-number-array", "float32-le"] },
        "storageQuantization": { "const": "none" },
        "preprocessingDigest": { "type": "string", "pattern": "^sha256:[0-9a-f]{64}$" },
        "spaceId": { "type": "string", "pattern": "^embed-v2:[0-9a-f]{64}$", "description": "Opaque declared-space id emitted by the canonical registry. Consumers do not rederive it, and it is not ResourceScope compatibility proof." },
        "quality": { "const": "degraded-fallback", "description": "Current registry rows remain degraded until separate attestation evidence promotes them." },
        "revisionBinding": { "const": "declared-upstream" },
        "runtimeBinding": { "const": "declarative-only" }
      },
      "description": "Complete canonical v2 declared-space profile supplied by the registry. The audit checks shape and loader alignment but never reimplements its digests or treats it as producer attestation."
    },
    "modelSelectedByDomainEval": {
      "type": "boolean",
      "description": "Evidence annotation only. It does not promote a declarative registry profile or authorize an approved quality state."
    },
    "rejectsIncompatibleSpaces": {
      "type": "boolean",
      "description": "Records the fail-closed requirement for a future separately attested comparison path; it does not authorize comparison now."
    },
    "vectorDisposition": {
      "type": "string",
      "enum": ["ephemeral-uncompared", "quarantined-uncompared"],
      "description": "Required disposition for vectors emitted from a declarative-only profile. Ordinary index persistence is forbidden."
    },
    "similarityComparisonEnabled": {
      "type": "boolean",
      "description": "Must be false for declarative-only profiles because this skill has no producer-attestation verifier."
    },
    "producerAttestation": false,
    "producerAttestationVerified": false,
    "attestationReceiptId": false,
    "lazyLoadPromiseCached": {
      "type": "boolean",
      "description": "True if the model load Promise is created lazily inside a function and cached so concurrent first calls share one download."
    },
    "allowLocalModels": {
      "type": "boolean",
      "description": "The value of env.allowLocalModels. Must be false in CI or the SDK fails looking for on-disk model files."
    },
    "cacheDirConfigured": {
      "type": "boolean",
      "description": "True if env.cacheDir is set to an explicit, controllable path."
    },
    "ciCachePersisted": {
      "type": "boolean",
      "description": "True if the model cache directory is persisted across CI runs (e.g. actions/cache)."
    },
    "persistsVectors": {
      "type": "boolean",
      "description": "True only for an explicit quarantined-uncompared artifact; declarative-only vectors cannot enter an ordinary index."
    },
    "copiesOutputBuffer": {
      "type": "boolean",
      "description": "True if outputs are copied on capture (new Float32Array(out.data)) rather than holding a view into a reused tensor buffer."
    },
    "modelVersionPinned": {
      "type": "boolean",
      "description": "True if the exact model id/revision is pinned in code, never 'latest'."
    },
    "dtype": {
      "type": "string",
      "enum": ["auto", "fp32", "fp16", "q8", "int8", "uint8", "q4", "bnb4", "q4f16", "q2", "q2f16", "q1", "q1f16"],
      "description": "Transformers.js v4 model-loader dtype. It is intentionally separate from embeddingProfile.coordinatePrecision, coordinateQuantization, and storageQuantization."
    },
    "fullPrecisionJustified": {
      "type": "boolean",
      "description": "True if a measured accuracy regression justifies full-precision weights over quantized."
    },
    "ciSmokeTest": {
      "type": "boolean",
      "description": "True if CI runs known inputs and asserts load success, dimensions, and finite coordinates without similarity comparison."
    }
  },
  "allOf": [
    {
      "if": {
        "properties": { "pipelineType": { "const": "bi-encoder" } },
        "required": ["pipelineType"]
      },
      "then": {
        "required": [
          "embeddingProfile",
          "loaderModelId",
          "loaderRevision",
          "maxInputTokens",
          "vectorDisposition",
          "similarityComparisonEnabled",
          "persistsVectors"
        ],
        "properties": {
          "similarityComparisonEnabled": { "const": false }
        },
        "allOf": [
          {
            "if": {
              "properties": { "vectorDisposition": { "const": "ephemeral-uncompared" } },
              "required": ["vectorDisposition"]
            },
            "then": {
              "properties": { "persistsVectors": { "const": false } }
            }
          },
          {
            "if": {
              "properties": { "persistsVectors": { "const": true } },
              "required": ["persistsVectors"]
            },
            "then": {
              "properties": { "vectorDisposition": { "const": "quarantined-uncompared" } }
            }
          },
          {
            "if": {
              "properties": { "vectorDisposition": { "const": "quarantined-uncompared" } },
              "required": ["vectorDisposition"]
            },
            "then": {
              "properties": { "persistsVectors": { "const": true } }
            }
          }
        ]
      }
    }
  ]
}
