{
  "pipelineType": "bi-encoder",
  "environment": "node",
  "runsInCI": true,
  "usesHighLevelPipeline": true,
  "readsRawLogits": false,
  "loaderModelId": "Xenova/all-MiniLM-L6-v2",
  "loaderRevision": "751bff37182d3f1213fa05d7196b954e230abad9",
  "maxInputTokens": 512,
  "pooling": "mean-attention-mask-v1",
  "normalizeEmbeddings": true,
  "embeddingProfile": {
    "servingProvider": "local-transformers-js",
    "executionClass": "local",
    "retrievalRoles": ["text_dense"],
    "qualityTier": "local_fast",
    "runtimeFamily": "transformers.js+onnxruntime-node",
    "runtimeVersion": "transformers.js@4.1.0+onnxruntime-node@1.24.3",
    "upstreamModelId": "Xenova/all-MiniLM-L6-v2",
    "modelRevision": "751bff37182d3f1213fa05d7196b954e230abad9",
    "modelArtifact": "onnx/model.onnx",
    "modelDigest": "sha256:759c3cd2b7fe7e93933ad23c4c9181b7396442a2ed746ec7c1d46192c469c46e",
    "modelConfigArtifact": "config.json",
    "modelConfigDigest": "sha256:7135149f7cffa1a573466c6e4d8423ed73b62fd2332c575bf738a0d033f70df7",
    "tokenizerId": "Xenova/all-MiniLM-L6-v2",
    "tokenizerRevision": "751bff37182d3f1213fa05d7196b954e230abad9",
    "tokenizerArtifact": "tokenizer.json",
    "tokenizerDigest": "sha256:da0e79933b9ed51798a3ae27893d3c5fa4a201126cef75586296df9b4d2c62a0",
    "tokenizerConfigArtifact": "tokenizer_config.json",
    "tokenizerConfigDigest": "sha256:9261e7d79b44c8195c1cada2b453e55b00aeb81e907a6664974b4d7776172ab3",
    "task": "feature-extraction",
    "queryPrefix": "",
    "documentPrefix": "",
    "unicodeNormalization": "tokenizer-defined",
    "truncation": "longest-first",
    "maxTokens": 512,
    "dimensions": 384,
    "normalization": "l2",
    "metric": "cosine",
    "pooling": "mean-attention-mask-v1",
    "coordinatePrecision": "float32",
    "coordinateQuantization": "none",
    "transportEncoding": "float32-array",
    "storageEncoding": "json-number-array",
    "storageQuantization": "none",
    "revisionBinding": "declared-upstream",
    "version": 2,
    "modelId": "Xenova/all-MiniLM-L6-v2",
    "preprocessingDigest": "sha256:67fcdea190a5d862ab741c5d12df4c891a556f2c54fd7ccbb341ec692c8ff0e6",
    "quality": "degraded-fallback",
    "runtimeBinding": "declarative-only",
    "spaceId": "embed-v2:76b6025e2a87cf9fd594508baadbc38289ab36c667f6492ed905314875d44173"
  },
  "modelSelectedByDomainEval": false,
  "rejectsIncompatibleSpaces": true,
  "vectorDisposition": "ephemeral-uncompared",
  "similarityComparisonEnabled": false,
  "lazyLoadPromiseCached": true,
  "allowLocalModels": false,
  "cacheDirConfigured": true,
  "ciCachePersisted": true,
  "persistsVectors": false,
  "copiesOutputBuffer": true,
  "modelVersionPinned": true,
  "dtype": "fp32",
  "fullPrecisionJustified": true,
  "ciSmokeTest": true
}
